{
  "$schema":"https://json-schema.org/draft/2020-12/schema",
  "title":"SCI-DOC AI Golden Annotation",
  "type":"object",
  "required":["case_id","annotation_schema_version","pages"],
  "properties":{
    "case_id":{"type":"string","minLength":1},
    "annotation_schema_version":{"type":"string"},
    "pages":{
      "type":"array",
      "items":{
        "type":"object",
        "required":["page_number","width","height","elements"],
        "properties":{
          "page_number":{"type":"integer","minimum":1},
          "width":{"type":"number","minimum":0},
          "height":{"type":"number","minimum":0},
          "elements":{
            "type":"array",
            "items":{
              "type":"object",
              "required":["annotation_id","annotation_type"],
              "properties":{
                "annotation_id":{"type":"string","minLength":1},
                "annotation_type":{"enum":["text","equation","diagram","table","layout","document"]},
                "element_id":{"type":["string","null"]},
                "source_text":{"type":["string","null"]},
                "target_text":{"type":["string","null"]},
                "bbox":{"type":["object","null"]},
                "structured":{"type":"object"}
              },
              "additionalProperties":true
            }
          }
        }
      }
    },
    "metadata":{"type":"object"}
  }
}